<xs:schema xmlns:xs="http://www.w3.org/2001/XMLSchema">
    <xs:element name="p">
        <xs:complexType>
            <xs:sequence>
                <xs:element name="class">
                    <xs:complexType>
                        <xs:sequence>
                            <xs:element name="student" maxOccurs="unbounded" minOccurs="0">
                                <xs:complexType>
                                    <xs:sequence>
                                        <xs:element type="xs:string" name="firstname"/>
                                        <xs:element type="xs:string" name="lastname"/>
                                        <xs:element type="xs:byte" name="age"/>
                                    </xs:sequence>
                                    <xs:attribute type="xs:byte" name="id" use="optional"/>
                                </xs:complexType>
                            </xs:element>
                        </xs:sequence>
                    </xs:complexType>
                </xs:element>
            </xs:sequence>
        </xs:complexType>
    </xs:element>
</xs:schema>